{
  "connector_id": "b1000000-0002-4000-8000-000000000002",
  "organization_id": "00000000-0000-0000-0000-000000000001",
  "connector_type": "webhook",
  "name": "Partner Webhook Connector",
  "description": "Outbound webhook for sending enriched orders to a partner system.",
  "category": "custom",
  "icon_url": null,
  "documentation_url": "https://docs.loxtep.com/connectors/webhook",
  "auth_type": "api_key",
  "oauth_config": null,
  "supported_directions": ["outbound"],
  "supported_entities": ["events", "orders"],
  "supports_webhooks": true,
  "supports_polling": false,
  "required_scopes": null,
  "required_permissions": null,
  "version": "1.0.0",
  "is_beta": false,
  "metadata": { "tags": ["webhook", "outbound", "partner"] },
  "created_at": "2026-02-17T00:00:00Z",
  "updated_at": "2026-02-17T00:00:00Z"
}
